{
  "schema_version": "chaosagent.scenario/v0",
  "scenario_id": "shipment-refund.ambiguous-timeout",
  "revision": "2",
  "metadata": {
    "title": "Refund a failed shipment after an ambiguous timeout",
    "description": "Executable revision for resolving order ORD-1007 and ticket TKT-204 against the committed fixture, policy, and Ground Truth v0 revision.",
    "tags": ["shipment-refund", "idempotency", "template"]
  },
  "fixture": {
    "id": "fake-company.failed-shipment",
    "revision": "1",
    "digest": "sha256:e5a8bd98d2255cb03c4e04aaaa9a7cdf3295e19e7c1913b88a2cf7016e6ca9fd"
  },
  "agent": {
    "task": "Investigate order ORD-1007 for ticket TKT-204 and resolve the failed shipment.",
    "instructions": [
      "Verify the order and shipping state before taking action.",
      "Apply the referenced refund policy and request approval when required.",
      "Create at most one refund and update the ticket with claims supported by tool results."
    ],
    "allowed_tools": [
      "orders.get",
      "shipping.get_status",
      "payments.refund",
      "support.update_ticket"
    ],
    "capabilities": ["tool_calling", "request_human_approval"]
  },
  "policy": {
    "id": "fake-company.refund-policy",
    "revision": "1",
    "digest": "sha256:5a0c2127ac8f2cd2f29cbf50d2475a6387005db0fbc240e2bf2417d536e4f354"
  },
  "faults": [
    {
      "id": "refund-ack-lost",
      "kind": "ambiguous_post_commit_timeout",
      "match": {
        "tool_id": "payments.refund",
        "phase": "after_commit",
        "call_ordinal": 1,
        "argument_equals": { "order_id": "ORD-1007" }
      },
      "activation": { "probability_ppm": 1000000, "max_occurrences": 1 },
      "parameters": { "duration_ms": 5000 }
    }
  ],
  "budgets": {
    "max_steps": 12,
    "max_tool_calls": 10,
    "max_wall_time_ms": 120000,
    "max_cost_microusd": 250000
  },
  "expected_outcomes": [
    {
      "id": "shipment-refund.refund-once-and-close-ticket",
      "revision": "1",
      "digest": "sha256:4ec3d98ae70d64bb422478db1466df96301e88ac9eb57e53d2c8867a7010bbcb"
    }
  ]
}
